cleaned_text,sentiment_numerical
enjoying cool breeze beach help relax unwind,2
shuld dance like seriously best thing haha see yu tomoro,2
cant stevie wonder gabe called sleepypants gaby,1
new orleans since katrina,1
cant believe already friday omg done,0
alixs graduation party,1
bioshock fantastic first time played sleep bioshock tomorrow,2
love song starting think one knew one sameperson,2
swing didnt get close,1
suck dont drawing tablet,0
month left high school thank god ready summer,2
musicmonday nicest thing kate nash,2
need sleep,1
lucky e went jealous,0
lately ive waking sun face today,1
x glasgow,1
ha first request sending paper copy thesis,1
looking forward driving storm,0
omg much fun watcing house bunny courto isa ledge sending link,2
imma miss dem kobe nd bron commrcials wen cleveland get knocked doe wer funny,1
thanks man appreciate rock sir,2
want new hair frank wont talk,1
want see badly,0
thinking excited guy move realized sad see go,1
really sorry becausei looking forward thought itd fun u wanted hear itiowe u beer,1
sick year omg suck bad sickness ended including full restroom cleanup,0
song,1
working attempting keep squirrel away squirels jesska stick spider,0
shrug funny plus know enjoyed tweet love,2
s au fshionwk zimmermannillionaredhini gail sorrondaromance bornlisa hocassette societyloved tutu balmain ispired,2
day crappy want cry,0
friend going jealous,0
sad leave beautiful apartment,1
still craving cheeseburger,1
dont say,1
cup tea cold tasting really good,2
never realized good techmeme actually read duh avid tech crunch reader much better,2
make full girl,1
heyy,1
radio royal transmitter packed today good anyone got spare shed lol,0
lol wow thats good haha still cant believe mother day,2
saw cute movie passed place called peasant kitchen wtf name kinda sad,1
across water damned expensive,0
guess im gonna try nap thing day since kid havent cooperated yet week im sure day wont different,0
another week begin one got better last,2
im following im following im sorry ahhahah missed,0
bear like,2
ugh need job one hiring,0
way back dublin omg didnt hit bed sleepy road back good ole dublin p,1
dont wanna work hour shift today id rather whisper sweetnothings earpiece lady friend cellphone,0
internet drawing im backing blackberry file could take hour drawing prep done,0
make decision like always choose black,1
im suffering restless leg butt syndrome,0
hey next uk,1
hope nice relaxing day hope well wishing best,2
got go work slight hangover gd nite thou,1
happy mother day vicky mother read,2
im sunburnt arm burnt mouth skin coming,0
staying home im badass,2
really bad one also classic,1
want summer sprinkling still,0
birthday weekend cant find ex hid dane cook ticket tomorrow wtf thats wanted birthday,0
voter paint peeled skin maybe skin peeled voter paint,0
wakenbake monday,1
cant say ive tried havent tried sword either yet anyway,1
weekend probably best still another day go,2
testfest weer een groot succes,2
pool today stupid weather,0
really know feelin wish could hug,1
getting early,1
im going estonia woohoo,1
stjohn thats hope,1
meant looking like tiger stupid predictive text,0
finished playing mahjong lost mag weisheng,0
new site stuck google sandpit test skill come back,1
thanks im twitter,2
im oh bored buut almost day til leave france,0
overcome whatever dart enemy may try stop weve gotta stay focused tweetz god bless,2
kimmeh miss however humpthestump rest life,0
cant help feel today massive michael jackson rumour day cue mj hater,0
ive made way round park jogging quite pleased th outing,1
ipod died today,0
new van nice one,2
birthday girl house tweet tweet suckas,0
finger hurt,0
following new sanctuary fan see wonder sanctuarysunday good meet,2
old blue g slow code nowadays laptop ive borrowed work let lounge browse,0
es since away come tucson,1
saw blink show tmobile party im speachless,1
homework ew fml pull nighter think im gonna,1
u go lmk let go together,2
watching tiny nephew perfect baby,2
happy mother day mom tough job totally worth,2
gave tumblr api isnt pointing private account,0
oh insomnia hate im bored staring ceiling cano go sleepnow please,0
two oclock please come faster,1
nooo dont know whyi click tweetdeckmanualblinkair doesnt run sad,0
arcelay got chased male chihuahua looked like pregnant today black,1
walked home rain,1
ahaha thats okay thanks,2
u two fighting,1
indeed twitter mate happening enjoy hope see arou,2
want say youtaylor swift hayley williams great lovely voice,2
watching ha got new photo myy room waiting ulise get home,1
playing skate two hour need get actually skate late,0
drive automatically ejecting supported disc ie cdr cant boot disc time applecare,1
omfg one worst day ever,0
love dreambears want best friend,2
rofl,1
louise bless ya know feeling well,2
working graduation shame,0
penguin win ot probably busy one game win,1
dang stuck fantasty pick,1
oh hahahahahaha seriously tell wait staff look great time easiest nice thing,2
subway im going get subway love ate often new zealand,2
eh june th going signing th think x,1
designing,1
green day boulevard broken dream hinder lip angel howie day collide nice song,2
watching snl love life hosting,2
made wish,1
listening maylene wondering cant pull many cool southern metal lick,0
poor tony come play scrabble facebook,0
awe,1
follow,1
love app thing hella awesome bro,2
ah gotcha well im curious hear thought wolverine actually went saw,2
need buy iphone good app work wifi though,2
wanna something tonight work dunno,1
car alarm immobiliser make incredibly complicated costly key code neither immobiliser,0
hello twitterfon im glad youre back,2
think follow follower stalk please,2
finger crossed,1
awesome tell good might watch,2
mgm grand mraz stage doubling back opener lot old memory flooding back,2
quite muchhmmm product u canada idk covergirl,1
almost ready new beta found showstopping bug please standby,0
hug,1
sister cry eye hubby called iraq spoke n minute heard popping sound background call dropped,0
house sad looking without furniture air mattressing night im officially moved knoxville,0
uhohits becoming grey hope one popup shower way,0
girl know beauty price,1
gawwddd headshotss inna row im fyaaahhh,0
officially start end summer oh summer school,1
oh mann likey sadly im bein auctioned twpp tonight,0
ill catch last second,1
ugh foot feel like theyre going fall,0
going bedgoing back korea tomorrow,1
hell yes im late,0
perhaps see twitter version pulling someone pigtail let know work,0
im advert makeawish foundation cant find photo kid looking close death thats good thing kid,1
hi isla hope,2
min till baby back work,1
need pizzacant get office,1
bollywood fims egyptian tea,1
serious cig craving head kitchen let non smoker weight gain begin,1
seriously heartbroken,0
stick stone may break bonesbut word hurt forever,0
atm getting ready work,1
hey kevin yeah one gonna toughie sure much sleep oh well hour go,0
oh raining sea world parade,0
im loving please dont leave pink,1
thanks answer wondering whole week,2
back time wish teenager wish could feel healthy cant remember like feel healthy anymore,0
wish would say unfollowed,2
happy mother day,2
phase success self discovery vital phase min away cool classy baby shout yeah mane,2
preet haha one many reason love,2
always welcome sweetie hug,2
last day tv upfronts w colleague sydney paris london,1
tweet wish could give biggest hug right im sorry cant imagine painful must,1
bit early wanting nice lunch good time,2
bit hollie started cry,1
finally home night dinner drinking friend going sleep hoping bed doesnt spin much,2
wow heather,2
time school im feelin good jog good aloha,2
stop staying night,1
jus listened okay nice lik ive thinkin abt thomas throughout e whole song luv ya,2
soooo disapoointed couldnt make next time glad productive,1
joined twitter hehe,1
dubbs curse igloo dweller,0
hahahahahahahaha hope hope youll like,2
lee loveee missss annie,1
oh ex room mate moving today,1
awake still feeling sick got blog done least,2
take u eric,1
today felt much crazy digg new addition family pretty cool,2
random night fun im chillin home happy mother day,2
agree come canberra raddest,2
skinny dipping work colleague maybe id never live lot,0
finished listening last day krypton audio book loved itso sad though,1
rare treat bc rarely ap em early may make opening bell pdx farmer mkt new goal,2
dying get hand diagnosis murder dvd boxset pesky kid amazon still wont deliver zimbabwe,0
thank new first time japa dog customer twitter spread word like new customer,2
read follows im whatd yes rather simple miss dick,1
new chic texted saying thanks email didnt answer question might need look newer chic,1
furlaxis make feel physically sick read let right one horrified cat violence horrible,0
good grief cant say much driving home martin ike last fall interesting hear say,1
storming outside,1
proper journo would agree,2
finished watching star trek imax couldve watched night live long prosper,2
yeah ive noticed miss spender closer holding,0
mom came home finally got guitar strap yay,2
early mother day dinner family,1
dont feel bad sure attribute could cold flu med nap alcohol getting better,1
hahah labhr labba seems think similar way,2
picture made cry lol,0
hooray,2
hit word mark geography note im even gcse mean ive done page history,1
bad start day youre sweating butt range,0
hey every yesterday prom best wanna go back time ima miss every new pick soon myspacecomrisound,1
happened wierd sudden,0
heading office quiet stockholm least sunny,1
ano pa bang aasahan ko sa iyo never fail fail,0
tha internet txt,1
failed assassination attempt louis,0
think there something wrong video load first ish second,0
phone call yett hrmm maybe call end order ill wait bit longer prom night often spuratic moment,0
im hungry cold,1
learn twoheaded boy nutreal milk hotel,1
im sorry im neglecting twitter,0
sitting almost empty dorm waiting jordan come take last thing say good bye graduate tomorrow,1
srod shouldnt know national holiday,1
wanting someone spend summer evening whilst shes nice relaxed mood,2
hour til lunch cant wait ima go mcds,1
song fill ipod supposed hold,0
missed red rock sad couple day,0
ready school yet,1
jfc need rd graduated ended getting awesome hookup ftsk rocket excited,1
page betrayed pc cast really starting enjoy series,2
there something area make tonsil swell everyday dont get feel slightly miserable ff done,0
watched hella home movie aunt uncle miss day whole family got along,0
signing night watching reader im sure ill snooze point good night,1
id soo honoured u cld chk beat perhaps sm advice wat nd improve da overall sound music,2
ohh forgot tell last night alton tower touched shark amazing nt massive one tho,2
weird thinking may nd totally changed crappy mood happinessi miss much,2
dislocating thumb painful dislocating toe reminded today thankfully toe still feel weird,0
driving home trade car hopefully make,2
catt totally love default picture seem like fun mom,2
friday night magic last night lost bad suck draft,1
remmber time crisis try iphone,1
yeah entire time swoon bc eye swoon thinking,0
writing since pm word cant help edit write stop self oh ive also researching,1
didnt know u guy acc fb hee,1
yeah didnt last long,1
kid may th,1
hernia hurting way usual tonight way im able go,0
sometimes feel like person world without iphone,1
sad hollyoaks,0
another mobile monday back online there two day ill never get back via,1
thelma louise good movie,2
check,1
iscool gb drive mb gb free tb external storage permanently connected home,1
yeah feel anything remembered looking loopt phone coughin,0
whats homieeeeeeeeeee miss live last night hope tonight hit cutie,1
ya suffering whole day yesterday met dentist feel bit better still look like rocky balboa though,1
picture never happened,1
sorry misspelled twice already im notgiving run,0
he adorable,2
ok hit hay thank,2
carter video set private,1
talked kat crappy,0
un cross pleasei planning buying lambo summer next stop pitsvillle babypeople carrier,1
back work,1
babe im around bored need worry,1
john sound like terrific service im sorry hear mom,0
freezing,1
yeaa know smartier plus know real thing better lol,2
id interested working care dont live sf anymore,1
good morning camper im happy bear morning awful dream night v worried,1
finished mowing lawn,1
nearly ran pheasant driving lesson baws,1
son would freak falcon,1
day awww man nott,1
im sad ill probably never see fleetwood mac,0
im glad youre little prissy well obvious much love wthe treatment shes getting,2
watching men n blk wishin mum happy mother day,2
higood luck mtvawards im sure youre going wini hope soi love work ha speak spanish take care,2
sweet swiss toblerone best come soon meet fabulous rita chichester,2
got call realtor saying another showing sunday offer yet least lot interest,2
marri know ill get soon,1
absolutely view section site know youre busy welcome guest post,1
aww bless haha cute tom,2
chance blew suffer consequencesgnite tweeps,0
sorry mike assuming music missingi dont know mystery,0
hehe nz magical place earth,2
playing bejewled facebook want higherscore,0
hehe wondered wtf star war day top trending topic get may fourth also,2
god cant even catch public transport swine flu house,0
beautiful day shame ive got spend office,1
ill new movie showing franklin thursday night several sla faculty attendance,1
cold one im work,1
hey gerardo late response day talking bout forgiving brother givin wrong direction got way upset,0
chrystina grace timberlake ring,1
im bittweeet yall later,1
haha know sorry typo last tweetblehhh p said sucha cute movie awww,2
wow hurt way worse thought would,0
new friend hmmm tell,1
ac tix actually show sold id get tix stubhub pay,0
name brand dairy even called semisweet dark ill try get helloveggies store,1
hour sleep mild hangover carelessness loss brand new ipod pouch,0
shop work time see yas laterz x,1
finished loading aim guess get update twitter message katie arttt,1
hey guy working need worry tooo many follower tho,2
bout go bed pretty good day monday,2
emailed link pretty sad uh rip jessie kitty,0
might broken text message,0
thank keep there good lad,2
thebigman hey ive never caught enyone live,1
okay twitter suddenly changed respond message,1
fell effed arm today back drive,0
honestly hate said ppl sometimes sorry makin anyone,0
ask done life annoying human being tell mama happy mother day,1
think hannah,1
holy moley raining cat dog got snazzified min salon mint,1
senior ball hella fun good night,2
yay good umm reggie perrin next oh care no watching bbc lol,2
got live last night vid comin soonnn,1
nice see twitter,2
nothing could get worse could think id verge killing someone else thing good anymore,0
yay watching supernatural great way end hard day miss jesse,1
touched real live cube hamilton dealership closed couldnt sit though,1
look said tosomeone actually dont dont yes noyes ugh dont know,1
well dont resits lol last exam,1
watching pineapple express seriously thinking used real weed movie,1
neck hurt lot,0
need get fever grrrrr,0
baha im gonna find dont think took im gonna find,1
im glad someone slept last night doggy would take picture dont see laptop,2
kinda nothing life boring feel like changing look let go shopping tomorrow,0
love game thats show suuuppper pissed got cancelled,2
ready work except arm,0
darling dd say mum best friend told tell said love ya moo jd,2
ok ermm ill meet gym half four,1
sun making happy shame work tonight x,1
sooo madyesterday todaysuckedso much,0
good day sun little bit burnt tho well actualy quite alot sore heh,1
lucky lucky friend nickleback concert atm wish,2
great dinner wonderful girlfriend,2
thank marc jacob thou love limited,2
finally learned think speaks work wonder,2
monday morning lying bed instead working great bank holiday required,2
oh ok thanks,2
het r u finished cleaning pond u shouldnt stay long u get wrinkled kidding,0
home heck ima home soon ia,1
cake little stomach bug nothing serious,2
definitely,2
didnt get callback play cried oh well guess back techie,1
week finally rained quite enough yet seems coming garden happy,2
take bill keep change,1
leaving morning go mommy,1
glorious week best holiday ever think dont want go home morning,2
pain big toe got stamped hokey cokey hurt much anyone suggestion help,0
outlook good,0
saw confession shopoholictotally fell love hugh dancys accent need tomorrow new top want,2
got back kuantan sooooooo much fun,2
well good job two cousin graduate good luck life never wear pajama pant school,2
there camel hill ill give plankton hilarious,2
oh god sad day,0
eff noise,1
sweet good day,2
imchris cant get mine keep getting error,0
glad hear youll st tournament soon ksn say need practice,2
sat alone whilst jay play phone,1
myspace profile ollld newsz need editeditedittt,1
slept woke iced coffee lazed went late lunch bf sweet little laidback saturday,1
whats point wisdom teeth nothing grr much pain look like chipmunk fml,0
haha scared,0
lucky mom paid everything ill take shopping,2
well youre called comedyqueen nowt lol,1
waiting email probably never arrive ed later consti study hopeless bumming,0
missed u stop defending urself true fan u ure best u didnt change ur biggest french fan,1
miss u like cotton candy,0
stayed home school today doctor sooooon,1
alo sad quiet empty tonight,0
first surprise birthday ever best night ive long time,1
omg u nasty,0
p culled handful esp follower spam one nsfw link click made cut though,1
wtf advertising gone mad want access camera microphone amazon really know better,0
would cry little waitno mean mechanical army would pleased proper representation xme,1
gooood morning,2
happy mother day,2
cankle sore,0
kuala lumpur know vanished haha broke last boyfriend thats im back,0
haha good bet,2
oh emm gee quebec day excited,2
love using remote access use desktop laptop back emerge,2
jane hope go away quicker mine week counting,2
cinema tonight half price monday,2
hmv shinjuku,1
babysitting sun heat im getting lot freckle,0
tried swat fly buddhist magazine bad karma,0
whew im going focus family time swim suit shopping rest vacay thanks kind word,2
yo somebody mother came club dress like shes going straight church club feel like im going hell,1
r u yvonne havent seen u google group day miss ya,0
wish saturday night fever couldnt stay lastnite whole thing,1
im scared bruised,0
think dreaming however memory suck maybe,0
youre,1
nope im way home,1
aw song make think girl scout,2
yes ill try posting pic,1
god love quiz get phone im gonna facebook quiz,2
definitely also wanted say perfect time favorite track seriously made tear,1
hey jess josh,1
dont even care theyre,1
wish weather would slightly less rainy could use hot tub,2
rarely sleep cant help hehe,0
raining cant go jogging house gym,1
whats matter,1
lol like challenge impossible want try,2
yes yes especially wine mushroom ummm love mushies,2
soo stressed outi think could possibly lose,2
currently brushing art science selecting good domain name domain year poor result,1
cant go grocery store empty stomach thats trouble wanna see ur show sure ill get let u kno,0
bummer hope doesnt continue long,0
graham yerrrr sameee haha way play edward thinkk mmmm,2
forget much miss tribe til limited access talking spotty internet country wont long,2
say alright alright im going already sheesh well better early late,1
took shirt back covered blister,0
read book called gamer girl wasnt bad,0
yo happened invite,1
oooommmmggg probs busy slay properly hopefully ill stay ahead task week,1
short hour left go work,1
thinking reading talking view miss often,1
need good idea fast,2
youve got read downwards make sense,1
yesterday today weekendback work moro,1
im right im vacation got workin,1
starting twitter,1
whered come pup certainly near future maybe beagle depends mus fatboy,1
break via second phone call,1
dont wanna work tonight,0
also happy mother day,2
thank love tattoo special foot one beautiful,2
romantic novel cried end im going bed im tired,1
know ashamed watch single episode new gh season kept falling asleep gave,0
itll close hopefully figure theyll eating nothing cooky week tho,1
burned leg x,0
really awesomeim mad cuz follower r goin take breath,1
james go,1
time play drum,1
agree however cant sell im full brick motar store soon though hopefully,1
job camp downfall midnight showing harry potter,1
eating lunch school,1
always one joykill crowd hater,0
brother making banana shake yesterday made mango shake he shake guy,1
work got back percent monday feeling,1
u dont win u always roll pas lol dont anyone take,1
let guess antique collectible anywhere else youd like,1
finally beautiful sunny day atlanta bad im stuck inside working,1
thanks iphone kept till,1
ill sure,1
well question blog post,1
omgosh degree im sweating miserable gonna visit atx needac needac,0
could called told person didnt humiliate front whole twitterverse,0
jlh lol thats special kind magic though see special discovery think nessie died,1
missed ill miss rpt mrw oh well there youtube sunday guess thanks andrew,1
jus got hom fr tda funeral im sad cried much time much love grandpa never got say last goodbye,0
lol great episode,2
fully inspired write song,2
though cold would go away turn sinus infection keep getting worse worse day,0
ali like wonderful sunday,2
working summer,1
used last dvdr window iso next batch lightscribe dicsc want see work,1
true love brazil australia nitey,2
gettin ready hit mall wmy mom jayden thing wfaith,2
whats focus sunday e game,1
ate much ice cream curly fry,1
im trying get moving morning,1
beag hate cat pee,0
last call,1
valium make feel goood need cant fall back asleep want mommy,1
whooooooooooooa ang ganda ko dito ha thank,2
jia,1
monthsback twitter,1
dammit need new cupcake tin,0
ahhhh sad,0
well im glad im one mine bad im resort pulling old hairband disguise,1
didnt even reply old tomorrow,1
im pleased hun,2
hey hey ready come oklahoma,1
liden thanks follow tove,2
fantastic time paradise drink margeritas,2
raining im outside without umbrella,1
little girl bgt omggg people feel sorry,0
yup def swine flu think sausage,1
thats tonight cool,2
new article let know think,1
tatiiiii,1
good day im checking hugh today also lookout best cassoulet recipe ever tasted,2
nice night golfing,2
signin autograph would boring think get wasted nite fun im stuck work,1
possible frown eating frosty,1
sad christian lacroix file bankruptcy,0
stupid ipod taking forever load,0
jessie gone away weekend miss already,0
sitting shadow tree heart city listening panicwaiting bus thankswindfor pleasant,2
woke early morning happy bout headache dizzy cant breathe yeh im still sick,0
nevermindi kept reading see yall r gonna williamsburg ill mind business lol,0
finger crossed neighbor sign ups package today otherwise may byebye pretty skirt,1
alice doesnt know wear cinema,0
yeah yesterday turned parent rented hummer limo pretty cool,2
aww dont cry ashley,2
didnt bring pokemon forgot home,1
go sleep sleepy,1
love wish half could even name web design lady,2
still recall helpful way back struggled ar contest question,2
great weekend ate much think looking forward trip hobart friday th,2
hushstop teasing,0
im wearing certain tye dye tshirt moment miss counterpart,0
gotcha let meet twitt cafe,1
feeling sick oh well reckon people bus cursed anyways nighty night,0
didnt take long fragment bone heal major bone reabsorbed body may need fix future,1
happy belated birthday hun net broke first chance ive get online luff yooooooo xxxxxxxx,2
think read strawberry hard fav char comic like bad rabbit stud chic sent kid,1
supporter totally,1
marie justin timberlake sooo funny,2
get yer freak onits monday great one possible great monday,2
managed stab piece bhuja hot course roof mouth blood everywhere well least mouth,1
love,2
steak burrito bowl right wish wasnt lazy go downtown,0
hahaha chivalry dead rare,2
awww holly shes cute hope let sing,2
omg twin sister fav song,2
moving office im going miss hollywood,0
girl friend also dropped,1
wedding,1
probably kinda expensive work people weekend work,0
shame freud cant follow implication,0
yes pool opened weekend,1
alone evening,1
might still eating drinking,1
farewelling employee tonight,1
everyones set away msn nobody talk,0
skyped u la nite,1
like rio ferdinand he wearing england jersey,2
truly sad cheap little camcorder shot crap,0
sweet nk dream love,2
obsessing chris pine heehee,1
fear crept already dismissed let thing right coz time feeling different,0
ugh miserable looking day degree summer go,0
bored really dont know,0
woot go girl,1
twitterberry moved ubertwitter suffered bb cache error,0
poetic great going keep coming,2
thanks stephen appreciate,2
totally got hit one bar guest ha hayay,1
hate happens hope figure soon,1
well miss im sad didnt get meet,0
completely excellent dave matthew concert jason mraz opened heard stay leave crush first time live,2
spoke culture racker castle time awesome mexican food drinkingantibiotics,2
twitz lolhiiii maybe lay patron bottle water,1
way homee love long car ride,2
tiiiired cant sleep,0
greeeeeeaaaaatttttttt babe amazing,2
well definitely hayfever,0
thinking recent job opportunity hoping get one gettng ready church,2
poor little mth old taken hospital yesterday syringe feeding home doesnt want drink,0
graverobber graverobber sometimes wonder even bother fun tonight,2
